{
  "schema_version": "frontend-projection/1.0",
  "package_version": "17.0.0",
  "disclosure": "All company, person, policy and event data in the demo is synthetic. Backend reference files are included separately and are not silently treated as correct frontend state.",
  "fund": {
    "id": "FUND-HARBOR",
    "name": "Harbor Private Capital",
    "date": "26 Aug 2026",
    "situations": [
      {
        "id": "SIT-KEYSTONE",
        "case_id": "PROJECT-KEYSTONE",
        "company": "Alderstone",
        "project": "Project Keystone",
        "lifecycle": "Active pursuit",
        "action_class": "authority_decision",
        "title": "Offer basis must be renewed",
        "why_now": "Customer parent exposure moved financing capacity and the current offer is no longer supported.",
        "objective": "Determine whether the $108m offer remains defensible.",
        "required_action": "Review the material exception and choose the offer treatment.",
        "authority_verb": "approve_offer",
        "owner": "A. Rossi",
        "deadline": "Today · 14:00",
        "capital": "$108.0m",
        "evidence": "Derived + attested",
        "status": "open",
        "priority_reasons": [
          "$108m capital at stake",
          "Authority deadline today",
          "Current offer is stale"
        ],
        "missions": [
          {
            "label": "Recompute financing case",
            "state": "complete",
            "progress": 100
          },
          {
            "label": "Read seven contracts",
            "state": "running",
            "progress": 42
          }
        ],
        "position": {
          "x": 59,
          "y": 42,
          "size": 88,
          "halo": "contested"
        }
      },
      {
        "id": "SIT-NORTHSTAR",
        "case_id": "PROJECT-NORTHSTAR",
        "company": "Northstar Systems",
        "project": "Project Northstar",
        "lifecycle": "Active pursuit",
        "action_class": "professional_review",
        "title": "ARR bridge needs reviewer sign-off",
        "why_now": "The latest cohort file changes normalized retention but not the base valuation.",
        "objective": "Sign the ARR and retention treatment.",
        "required_action": "Review prepared treatment.",
        "authority_verb": "advise",
        "owner": "L. Chen",
        "deadline": "Tomorrow",
        "capital": "$36.0m",
        "evidence": "Observed",
        "status": "open",
        "priority_reasons": [
          "Evidence newly observed",
          "Model branch waiting"
        ],
        "missions": [
          {
            "label": "Cohort reconstruction",
            "state": "waiting",
            "progress": 82
          }
        ],
        "position": {
          "x": 27,
          "y": 58,
          "size": 58,
          "halo": "review"
        }
      },
      {
        "id": "SIT-MERIDIAN",
        "case_id": "PROJECT-MERIDIAN",
        "company": "Meridian Health",
        "project": "Project Meridian",
        "lifecycle": "Owned investment",
        "action_class": "notification",
        "title": "Runway is below the approved intervention line",
        "why_now": "Hiring remained ahead of plan while collections slipped by 19 days.",
        "objective": "Prepare the next board intervention.",
        "required_action": "Inspect variance diagnosis.",
        "authority_verb": "recommend",
        "owner": "J. Morgan",
        "deadline": "Friday",
        "capital": "$18.4m",
        "evidence": "Observed",
        "status": "active",
        "priority_reasons": [
          "Liquidity threshold crossed",
          "Board in 4 days"
        ],
        "missions": [
          {
            "label": "Variance diagnosis",
            "state": "complete",
            "progress": 100
          }
        ],
        "position": {
          "x": 76,
          "y": 69,
          "size": 52,
          "halo": "blocked"
        }
      },
      {
        "id": "SIT-SCOUT",
        "case_id": "PROJECT-SCOUT",
        "company": "Scout Search",
        "project": "Scout pilot",
        "lifecycle": "Active pursuit",
        "action_class": "professional_review",
        "title": "Next-best work is customer references",
        "why_now": "Commercial uncertainty dominates the remaining decision variance.",
        "objective": "Close the highest-value unknown.",
        "required_action": "Approve the reference-call plan.",
        "authority_verb": "advise",
        "owner": "Search lead",
        "deadline": "This week",
        "capital": "$6.5m",
        "evidence": "Inferred",
        "status": "open",
        "priority_reasons": [
          "Highest value of information",
          "Low closure cost"
        ],
        "missions": [
          {
            "label": "Reference list preparation",
            "state": "running",
            "progress": 64
          }
        ],
        "position": {
          "x": 42,
          "y": 78,
          "size": 40,
          "halo": "unknown"
        }
      }
    ],
    "morning_delta": [
      {
        "id": "DELTA-1",
        "kind": "material",
        "label": "Keystone offer basis became stale",
        "detail": "18.2% parent exposure activated a financing exception.",
        "case_id": "PROJECT-KEYSTONE"
      },
      {
        "id": "DELTA-2",
        "kind": "review",
        "label": "Northstar cohort treatment is ready",
        "detail": "Reviewer sign-off is the only remaining blocker.",
        "case_id": "PROJECT-NORTHSTAR"
      },
      {
        "id": "DELTA-3",
        "kind": "monitor",
        "label": "Meridian runway crossed the intervention line",
        "detail": "Board action now ranks above routine monitoring.",
        "case_id": "PROJECT-MERIDIAN"
      },
      {
        "id": "DELTA-4",
        "kind": "work",
        "label": "Scout next-best work changed",
        "detail": "Customer references now dominate decision value.",
        "case_id": "PROJECT-SCOUT"
      }
    ]
  },
  "deal": {
    "case_id": "PROJECT-KEYSTONE",
    "objective": {
      "verb": "defend",
      "target": "the $108m offer",
      "statement": "Determine whether the $108m offer remains defensible on verified earnings and customer risk.",
      "deadline": "10 Mar 2026 · 09:00",
      "status": "active"
    },
    "branches": {
      "approved": "Final IC · 10 Mar 2026",
      "current": "Concentration review · 5 Feb 2026",
      "working": "Working Branch 17"
    },
    "morning_delta": {
      "label": "Customer concentration basis changed",
      "from": "7.6% account view",
      "to": "18.2% ultimate-parent view",
      "source": "VDR customer master"
    },
    "next_best_work": {
      "id": "NBW-CONTRACTS",
      "label": "Read the seven Riverton contracts",
      "reason": "Highest decision value ÷ closure cost",
      "owner": "A. Rossi",
      "duration": "4h",
      "unlocks": "Customer durability treatment and offer authority"
    },
    "command_suggestions": [
      "What changed since the last review?",
      "What does the deal rest on?",
      "Show every unresolved risk accepted by IC",
      "Which artifact is stale?",
      "What should we do next?"
    ],
    "rooms": {
      "foundations": {
        "title": "What the deal rests on",
        "subtitle": "Minimal support sets for the current investment case.",
        "sets": [
          {
            "id": "FND-EARNINGS",
            "label": "Underwritten earnings",
            "strength": "contested",
            "economic": "$5.4m ceiling sensitivity",
            "members": [
              "QoE EBITDA $11.9m",
              "Firm reserve to $11.4m",
              "$0.5m initiatives rejected"
            ],
            "question_id": "UQ-EARNINGS"
          },
          {
            "id": "FND-REVENUE",
            "label": "Revenue durability",
            "strength": "weak",
            "economic": "18.2% parent exposure",
            "members": [
              "Seven accounts aggregate to Riverton",
              "No minimum-volume guarantee",
              "Multi-site tenure supports partial durability"
            ],
            "question_id": "UQ-REVENUE"
          },
          {
            "id": "FND-CASH",
            "label": "Cash conversion",
            "strength": "contested",
            "economic": "$0.7m closing delta",
            "members": [
              "QoE NWC target $8.4m",
              "Seller target $7.7m",
              "Billing controls remain fragmented"
            ],
            "question_id": "UQ-CASH"
          },
          {
            "id": "FND-INTEGRATION",
            "label": "Integration execution",
            "strength": "accepted-risk",
            "economic": "$2.0m funded plan",
            "members": [
              "Commercial integration exists",
              "Systems remain fragmented",
              "IC accepted risk under conditions"
            ],
            "question_id": "UQ-INTEGRATION"
          }
        ]
      },
      "unknowns": {
        "title": "Everything we still do not know",
        "subtitle": "Ordered by expected decision value, not document order.",
        "items": [
          {
            "id": "UNK-CONTRACTS",
            "rank": 1,
            "label": "Can Riverton reduce volume without penalty?",
            "value": "Very high",
            "closure": "Read 7 contracts · 4h",
            "owner": "A. Rossi",
            "question_id": "UQ-REVENUE"
          },
          {
            "id": "UNK-RETENTION",
            "rank": 2,
            "label": "Would a 20% Riverton reduction be operationally absorbable?",
            "value": "High",
            "closure": "2 reference calls · 1 day",
            "owner": "Commercial",
            "question_id": "UQ-REVENUE"
          },
          {
            "id": "UNK-INTEGRATION",
            "rank": 3,
            "label": "Can Project Unify cut over without billing disruption?",
            "value": "High",